{
  "project_name": "",
  "slug": "",
  "state": "active",
  "current_phase": "startup",
  "summary": "",
  "latest_decision": "",
  "open_questions": [],
  "next_step": "",
  "current_phase_gate": "pending",
  "blocking_issues": [],
  "checklist_files": {
    "human": "PROJECT-CHECKLIST.md",
    "machine": "project-checklist.json"
  }
}
